### ISSUE TITLE
xivgui doesn't connect to xiv

### ISSUE THREAD

**Issue by i5513** [sshuttle/sshuttle#197]
Hello,
I'm trying to use xivgui connecting to  a xiv IBM storage though sshuttle

It does not connect

When I sniff with tcpdump conections to xiv ip, I see a weird behaviour:

I sniff on server (which sshuttle connect to) and on my computer. tcpdump -i any host ip-xiv

Then I can see how the connection is closed at the beggining (only 7 packages)

But, Examining the tcpdump files:
Captured on server:
1	0.000000	Jan 24, 2018 **10:30:33.975833000** CET	_SERVER-IP_	50234	_XIV-IP_	7778	50234 → 7778 [SYN] Seq=0 Win=14600 Len=0 MSS=1460 SACK_PERM=1 TSval=2520959442 TSecr=0 WS=128	
...
Captured on my computer:
562	0.000000	Jan 24, 2018 **10:30:33.970595000** CET	_XIV-IP_	7778	_MY-COMPUTER-IP_ 51766	7778 → 51766 [SYN, ACK] Seq=0 Ack=1 Win=43690 Len=0 MSS=65495 SACK_PERM=1 TSval=3259322944 TSecr=3808859729 WS=128	

I was thinking that with sshuttle I should not see any package from _XIV-IP_ on my computer

I can see how SYN package arrive after that SYN, ACK (10:30:33.975833000>10:30:33.970595000). Both (my computer and server) are ntp synchronized [ but I think they are not enough syncrhonized because of this issue ]. Maybe I can force my clock to be 300 ms unsynchronized ...

How could I fix this issue ? I cannot test on another jump host ( i was going to test with a phisical server (and not virtual)) but I cannot :(

Do you know what can be happening here ?

Thank you !

**Comment by brianmay** [comment]
There are two TCP connections involved. There is the TCP connection between the client and the client sshuttle (using a fake IP address for sshuttle. There is also the real TCP connection between the server sshuttle and the server.

You have shown an excerpt from one TCP connection, and and excerpt from the other TCP connection. There is no connection between the two, This doesn't help solve the problem, sorry.

Also I assume you mean packets, not packages? Or is this some sort of xiv concept? I am not familiar with xiv.

**Comment by i5513** [comment]
Hello @brianmay,

xiv is a IBM Storage System. xivgui is a java client that connect with it.

Please see,  the output of tcpdump 10.118.85.144 when I'm trying to connect to XIV storage system via the client when sshuttle is running:

* 10.118.85.144 is my ip , 192.168.3.34 is xiv ip, 10.189.3.4 is the jump server

I still think I should not see packets (sorry for my bad english) from 192.168.3.34 on my computer

I'm running java with ipv4 as protocol preferred
```
/opt/IBM_XIV_Storage_Management_GUI/jre/bin/java -Djava.net.preferIPv4Stack=true -Xmx1g -Xminf0.2 -Xmaxf0.4 -Xgcpolicy:gencon com.zerog.lax.LAX /opt/IBM_XIV_Storage_Management_GUI/xivgui.lax /tmp/env.properties.4356
```

```
javi@fideo:~/tmp$ sudo tcpdump -i any host 192.168.3.34 -n # and in another console I exec "xivgui"
tcpdump: verbose output suppressed, use -v or -vv for full protocol decode
listening on any, link-type LINUX_SLL (Linux cooked), capture size 262144 bytes
09:14:01.690708 IP 192.168.3.34.7778 > 10.118.85.144.57746: Flags [S.], seq 4014633696, ack 2022731611, win 43690, options [mss 65495,sackOK,TS val 3313801645 ecr 2129951192,nop,wscale 7], length 0
09:14:02.168102 IP 192.168.3.34.7778 > 10.118.85.144.57746: Flags [.], ack 87, win 342, options [nop,nop,TS val 3313802122 ecr 2129951669], length 0
09:14:02.189260 IP 192.168.3.34.7778 > 10.118.85.144.57746: Flags [P.], seq 1:8, ack 87, win 342, options [nop,nop,TS val 3313802143 ecr 2129951669], length 7
09:14:02.189326 IP 192.168.3.34.7778 > 10.118.85.144.57746: Flags [F.], seq 8, ack 87, win 342, options [nop,nop,TS val 3313802143 ecr 2129951690], length 0
09:14:02.190323 IP 192.168.3.34.7778 > 10.118.85.144.57746: Flags [.], ack 88, win 342, options [nop,nop,TS val 3313802144 ecr 2129951691], length 0
javi@fideo:~/tmp$ ps -ef | grep sshuttle
javi      2753     1  0 08:57 ?        00:00:00 logger -p daemon notice -t sshuttle
root      2754     1  0 08:57 ?        00:00:00 sudo -p [local sudo] Password:  PYTHONPATH=/usr/lib/python3/dist-packages -- /usr/bin/python3 /usr/bin/sshuttle --method auto --firewall --syslog
root      2756  2754  0 08:57 ?        00:00:00 /usr/bin/python3 /usr/bin/sshuttle --method auto --firewall --syslog
root      2757  2756  0 08:57 ?        00:00:00 logger -p daemon notice -t sshuttle
javi      2760     1  0 08:57 ?        00:00:01 /usr/bin/python3 /usr/bin/sshuttle --pidfile=/home/javi/.sshuttle.pid --no-latency-control --dns -D -r 10.189.3.4 192.168.0.0/16 # and more networks
```

**Comment by brianmay** [comment]
i5513 <notifications@github.com> writes:

> I still think I should not see packets (sorry for my bad english) from
> 192.168.3.34 on my computer

Sorry, you have lost me here. How do you think you can communicate with
192.168.3.34 if you don't see any packets from 192.168.3.34?

These packets should be generated from the sshuttle client with a fake
source IP address.
-- 
Brian May <brian@linuxpenguins.xyz>
https://linuxpenguins.xyz/brian/

**Comment by i5513** [comment]
> Sorry, you have lost me here. How do you think you can communicate with 192.168.3.34 if you don't see any packets from 192.168.3.34? 

Well, yes, I see packets from 192.168.3.34 (XIV). My computer is "fideo" (10.118.85.144)

From fideo:
```
javi@fideo:~/tmp$ sudo tcpdump -i any host 192.168.3.34 -n # and in another console I exec "xivgui"
tcpdump: verbose output suppressed, use -v or -vv for full protocol decode
listening on any, link-type LINUX_SLL (Linux cooked), capture size 262144 bytes
09:14:01.690708 IP 192.168.3.34.7778 > 10.118.85.144.57746: Flags [S.], seq 4014633696, ack 2022731611, win 43690, options [mss 65495,sackOK,TS val 3313801645 ecr 2129951192,nop,wscale 7], length 0
09:14:02.168102 IP 192.168.3.34.7778 > 10.118.85.144.57746: Flags [.], ack 87, win 342, options [nop,nop,TS val 3313802122 ecr 2129951669], length 0
09:14:02.189260 IP 192.168.3.34.7778 > 10.118.85.144.57746: Flags [P.], seq 1:8, ack 87, win 342, options [nop,nop,TS val 3313802143 ecr 2129951669], length 7
09:14:02.189326 IP 192.168.3.34.7778 > 10.118.85.144.57746: Flags [F.], seq 8, ack 87, win 342, options [nop,nop,TS val 3313802143 ecr 2129951690], length 0
09:14:02.190323 IP 192.168.3.34.7778 > 10.118.85.144.57746: Flags [.], ack 88, win 342, options [nop,nop,TS val 3313802144 ecr 2129951691], length 0
```
7778 is the port where XIV is listening ( more info at 
https://www.ibm.com/support/knowledgecenter/en/STJTAG/com.ibm.help.xivgen3.doc/Gen3/PG/xiv_pln3physicalmanagementports.html)
```
Proprietary protocols are used to manage the XIV system from the IBM XIV Storage Management GUI and IBM XIV command-line interface (XCLI). This management communication is over TCP port 7778. The XIV GUI and XCLI act as the client and initiate the connection. The XIV system acts as the server. All traffic over this port is encrypted through the Secure Sockets Layer (SSL) protocol.
```

I hope I clarified your doubt

Thank you very much

**Comment by brianmay** [comment]
All the TCP dumps show is what appears to be a normal working system. They do not show any problems, and - unfortunately - as such cannot be used to diagnose any problems.

It is possible that the server has discovered something it doesn't like - e.g. maybe it doesn't like seeing the IP connection of the proxy server, and as such it closes the connection.

Also, SYN packets are used to open connections, FIN packets are to close them.

**Comment by i5513** [comment]
Then I don't understand how sshuttle work
I was thinking on the next tcp connections:
my computer <=sshuttle=> jump server <=> XIV Storage

But I see at least:
my computer <=sshuttle=> jump server <=> XIV Storage
XIV Storage => my computer

But my computer is not routable from XIV Storage (and XIV Storage is not routable without sshuttle from my computer), so XIV Storage => my computer are not normal on my network

I was thinking XIV Storage should be my client with the jump server ip address

For clarification, when I run x2go to jump server I can run xivgui without any problem. So jump server is allowed to manage XIV Storage

Thank for your time . If you don't want to spend more time, dont worry and close this bug. We can assume this is something that the proprietary protocol detect with sshuttle but doesn't detect with x2go.

For me is a mistery, what am I wrong ?

**Comment by brianmay** [comment]
i5513 <notifications@github.com> writes:

> Then I don't understand how sshuttle work
> I was thinking on the next tcp connections:
> my computer <=sshuttle=> jump server <=> XIV Storage

This is absolutely correct. There are two completely independant TCP
connections involved.

The sshuttle server pretends to have the same IP address as XIV Storage.

So "my computer" will have a TCP connection IP(XIV Stoage) and receive
packets from IP(XIV Storage). In actual fact sshuttle terminates this
connection, not XIV Storage. sshuttle is acting like a transparent
proxy.

sshuttle will relay packets to/from the 2nd TCP connection. This is real
TCP connection. This is the TCP connection between the "jump server" and
the "XIV Storage" and will behave exactly like a normal TCP connection
would.

The two TCP connections are completely independent, and have nothing in
common. Despite the fact they use the same IP address.

Does this help?
-- 
Brian May <brian@linuxpenguins.xyz>
https://linuxpenguins.xyz/brian/

**Comment by i5513** [comment]
Thank you very much, now I understand. Closing this issue, because surely will be XIV storage which have any mechanism which limit this kind of use
